{
  "task_id": "task-001-enron-investigation",
  "participant_id": "baseline-prompt-only",
  "title": "Enron Investigation Brief \u2014 Baseline Prompt-Only Analysis [SAMPLE]",
  "submitted_at": "2025-01-15T14:32:00Z",
  "context_strategy": "Random sample of 50 emails from the processed dataset. No retrieval, no indexing. Single LLM call with all 50 emails in the prompt context. Model: claude-3-haiku-20240307.",
  "executive_summary": "The 50-email random sample reviewed for this baseline analysis captures a narrow slice of Enron's internal communication in the months before the company's December 2001 bankruptcy filing. From this limited window, several patterns are visible: a marked increase in emails concerning financial reporting and analyst communications in October\u2013November 2001, references to off-balance-sheet structures using oblique language ('the vehicles,' 'the arrangements'), and a pronounced shift in the tone of executive communications from confident to circumspect over the final quarter.\n\nThe most striking finding from the sampled emails is the apparent compartmentalization of knowledge about the special purpose entities. Mid-level finance staff appear to have had limited visibility into the full scope of the LJM and Raptor structures, while senior treasury and CFO office staff communicated in terms that assumed a shared but unstated understanding of the arrangements. This compartmentalization, while not definitive evidence of deliberate concealment, is consistent with the post-collapse findings of the Powers Report and SEC investigation.\n\nCommunication patterns around the Q3 2001 earnings announcement suggest that investor relations and communications staff were receiving guidance to 'hold' on analyst inquiries and coordinate messaging before releasing information about the Raptor write-downs. Several sampled emails reference 'coordination with the executive team' before press responses could be issued, which is unusual for routine quarterly communications.\n\nCRITICAL LIMITATION: This analysis is based on only 50 of 517,401 emails in the Enron corpus. The probability that any specific key email \u2014 the Sherron Watkins memo, the Fastow-Glisan Raptor coordination emails, the Skilling-Lay communications about the stock decline \u2014 appeared in this random sample is very low (below 0.01%). The claims in this brief are weakly evidenced and should be treated as preliminary hypotheses rather than conclusions. The context trace attached to this submission shows the exact 50 emails that were read.",
  "sections": [
    {
      "id": "executive-summary",
      "title": "Executive Summary",
      "content": "This investigation brief analyzes a 50-email sample from the Enron Email Dataset (CMU/FERC release, 517,401 total emails) for early warning signs of the corporate collapse that culminated in Enron's December 2001 bankruptcy. The sample is limited and non-representative; findings should be treated as preliminary. The most notable patterns: (1) oblique language about financial structures in emails between treasury and finance staff, (2) messaging coordination directives around earnings announcements, and (3) concern expressed by mid-level employees about stock price declines and 'accounting questions from analysts.' None of these patterns, individually, constitute proof of fraud. Together, they are consistent with the broader picture established by the Powers Report and SEC investigation. See the Ethical and Evidentiary Limitations section for important caveats."
    },
    {
      "id": "investigative-timeline",
      "title": "Investigative Timeline",
      "content": "The following timeline is constructed from (a) emails in the 50-email sample where dates could be parsed and (b) external context events labeled as such. Corpus-derived events are marked [CORPUS]; external context events are marked [EXTERNAL-CONTEXT].\n\n1998 Q4 [EXTERNAL-CONTEXT]: Chewco and JEDI partnerships restructured. Andy Fastow begins managing outside partnerships simultaneously with his CFO role.\n\n1999 Q1 [EXTERNAL-CONTEXT]: LJM Cayman LP established. Fastow discloses to board that he will manage it; board approves with conditions.\n\n2000 Q1\u2013Q2 [CORPUS, weak signal]: Sampled emails from early 2000 show high confidence in Enron's trading business. References to 'EES growth targets' and 'broadband pipeline forecasts.' Tone is expansive.\n\n2001 Q2 [EXTERNAL-CONTEXT]: Cliff Baxter resigns as Vice Chairman. Internal emails (not in sample) later revealed concerns about aggressive accounting.\n\n2001 Aug 14 [EXTERNAL-CONTEXT]: Jeff Skilling resigns as CEO after 6 months, citing personal reasons. Ken Lay resumes CEO role.\n\n2001 Aug\u2013Sep [CORPUS, weak signal]: Sampled emails from this period show references to 'analyst questions about the trading book' and requests for messaging alignment before earnings calls.\n\n2001 Oct 16 [CORPUS, moderate signal]: Emails reference a '$544 million' charge and 'Raptor vehicle write-down.' One sampled email from investor relations mentions 'holding all responses on Raptor questions.'\n\n2001 Oct 22 [EXTERNAL-CONTEXT]: SEC begins inquiry into Enron's accounting practices.\n\n2001 Nov 8 [EXTERNAL-CONTEXT]: Enron restates five years of financial results, wiping out $586 million in profits.\n\n2001 Dec 2 [EXTERNAL-CONTEXT]: Enron files for Chapter 11 bankruptcy, then the largest in US history."
    },
    {
      "id": "key-people-and-communication-patterns",
      "title": "Key People and Communication Patterns",
      "content": "From the 50-email sample, the following individuals appear with meaningful frequency:\n\n1. Ken Lay (kenneth.lay@enron.com) \u2014 Chairman and CEO (post-August 2001). Appears in 3 sampled emails. Tone is reassuring and outward-facing. References to 'fundamental strength of the business.'\n\n2. Jeff Skilling (jeffrey.skilling@enron.com) \u2014 CEO (resigned August 2001). Appears in 2 pre-resignation emails. Brief, directive communications.\n\n3. Andy Fastow (andrew.fastow@enron.com) \u2014 CFO. Appears in 4 sampled emails. References to 'LJM schedule' and 'vehicle closing docs.' Emails suggest coordination with outside counsel on transaction structures.\n\n4. Mark Koenig (mark.koenig@enron.com) \u2014 Head of Investor Relations. Appears in 3 sampled emails. Directs that analyst inquiries be held pending executive alignment.\n\n5. Sherron Watkins (sherron.watkins@enron.com) \u2014 VP Corporate Development. Does NOT appear in this sample, but is mentioned once in a forwarded email chain. The famous August 2001 memo to Lay is not in this sample.\n\nCommunication pattern note: The most frequent communication pattern in the sample is finance-to-investor-relations chains where deal-specific language is present in the finance emails but is abstracted or omitted in the investor relations messaging. This is consistent with deliberate information sanitization, though it could also reflect normal investor communications practice."
    },
    {
      "id": "main-themes-and-topic-clusters",
      "title": "Main Themes and Topic Clusters",
      "content": "Analysis of the 50-email sample reveals five topic clusters:\n\n1. TRADING OPERATIONS (18 emails): Routine energy trading communications. Low investigative relevance. Shows Enron's trading desk was active and processing large volumes.\n\n2. EARNINGS AND ANALYST COMMUNICATIONS (12 emails): Higher relevance. Several show messaging coordination and 'hold' directives around analyst questions. References to Raptor write-down.\n\n3. FINANCIAL STRUCTURES AND VEHICLES (7 emails): Highest relevance. References to LJM, Raptor, and 'the vehicles' using oblique language. Coordination between CFO office and treasury.\n\n4. HR AND ADMINISTRATIVE (9 emails): Low relevance. Standard employee communications, benefits notices, travel.\n\n5. LEGAL AND REGULATORY (4 emails): Moderate relevance. References to outside counsel involvement in 'vehicle closings' and one email mentioning an SEC inquiry in October 2001."
    },
    {
      "id": "evidence-backed-claims",
      "title": "Evidence-Backed Claims",
      "content": "The following claims are supported by evidence from the 50-email sample. Each is labeled by type. Note that all evidence is from a small, non-representative sample.\n\nCLAIM 1 (fact): Fastow's email address (andrew.fastow@enron.com) was used to communicate about LJM transaction closing schedules with Enron treasury staff.\nEvidence: ev-003 (see evidence section)\nConfidence: 0.75 (email attribution is reliable; content is partially redacted in sample)\n\nCLAIM 2 (fact): Mark Koenig, Head of Investor Relations, directed staff to hold all responses to analyst inquiries about 'Raptor questions' until executive team coordination was complete.\nEvidence: ev-007\nConfidence: 0.82\n\nCLAIM 3 (interpretation): The use of oblique terminology ('the vehicles,' 'the arrangement,' 'the structure') in finance-to-treasury emails, without spelling out what the vehicles were, suggests that participants assumed shared knowledge that was not intended to be documented explicitly.\nEvidence: ev-003, ev-006, ev-009\nConfidence: 0.52\n\nCLAIM 4 (uncertainty): Sherron Watkins may have sent additional internal communications beyond the famous August 2001 memo, but none appeared in this 50-email sample.\nEvidence: None in sample\nConfidence: 0.20 (plausible based on general knowledge, not supported by this dataset)\n\nCLAIM 5 (uncertainty): The full scope of executive knowledge of the accounting irregularities cannot be determined from 50 random emails.\nEvidence: Absence of evidence\nConfidence: N/A \u2014 uncertainty claim"
    },
    {
      "id": "contradictions-and-weak-signals",
      "title": "Contradictions and Weak Signals",